{
  "$schema": "./ultrathink.discovery.schema.json",
  "schemaVersion": "1.0.0",
  "identity": {
    "repository": "claude-ultrathink",
    "repositoryUrl": "https://github.com/swcstudiospace/claude-ultrathink",
    "package": "ultrathink",
    "plugin": "ultrathink",
    "marketplace": "ultrathink"
  },
  "description": "claude-ultrathink is a cross-agent reasoning plugin providing prompt uplift, Graph of Thought, Chain of Thought and HITL clarifications. Adapters are listed from repository sources. Grok Bot is a native host: bin/ultrathink-grokbot runs the engine, the bot answers its prompts and skills replace the prompt hook; compatibility is not verified. GPT Dot remains pending and unverified.",
  "capabilities": [
    "prompt-uplift",
    "graph-of-thought",
    "chain-of-thought",
    "hitl-clarifications",
    "local-plan-artifact-handoff",
    "planning-controls",
    "tracker-mcp-relay"
  ],
  "hosts": {
    "claude-code": {
      "status": "source-present",
      "entrypoints": [
        ".claude-plugin/plugin.json",
        ".claude-plugin/marketplace.json",
        "hooks/hooks.json",
        "hooks/uplift.ts"
      ],
      "delivery": "hook-additional-context"
    },
    "grok-build": {
      "status": "source-present",
      "entrypoints": [
        "hooks/uplift.ts",
        "scripts/setup.ts",
        "hosts/grok/ultrathink.md"
      ],
      "delivery": "local-plan-carrier"
    },
    "hermes": {
      "status": "source-present",
      "entrypoints": [
        "hosts/hermes/plugin.yaml",
        "hosts/hermes/__init__.py",
        "hosts/hermes/bridge.py",
        "hooks/engine.ts"
      ],
      "delivery": "pre-llm-plan-handoff"
    },
    "muse": {
      "status": "source-present",
      "entrypoints": [
        ".muse-plugin/plugin.json",
        "hooks/muse-prompt",
        "hooks/uplift.ts"
      ],
      "delivery": "hook-additional-context"
    },
    "omp": {
      "status": "source-present",
      "entrypoints": [
        "package.json",
        ".omp-plugin/marketplace.json",
        "src/host/omp.ts"
      ],
      "delivery": "extension-inline-or-deferred-aside"
    },
    "prime-agent": {
      "status": "source-present",
      "entrypoints": [
        "hosts/prime-agent/SKILL.md",
        "hosts/prime-agent/pyproject.toml",
        "hosts/prime-agent/src/ultrathink/__init__.py",
        "hooks/engine.ts"
      ],
      "delivery": "kernel-skill-return"
    },
    "cursor": {
      "status": "source-present",
      "entrypoints": [
        ".cursor-plugin/plugin.json",
        "hosts/cursor/ultrathink-cursor-plan.js",
        "scripts/cursor-plugin.ts",
        "hooks/engine.ts"
      ],
      "delivery": "hook-additional-context"
    }
  },
  "interfaces": {
    "jsonPlanner": {
      "transport": "json-stdin-stdout",
      "launcher": "bin/run-bun",
      "entrypoint": "hooks/engine.ts",
      "responseType": "PlanResponse"
    },
    "controls": {
      "entrypoint": "bin/ultrathink",
      "canPlan": false
    },
    "trackerMcp": {
      "transport": "mcp-stdio-relay",
      "entrypoint": "bin/ultrathink-mcp",
      "providers": ["notion", "linear", "greptile"],
      "canPlan": false
    }
  },
  "externalIntegrations": {
    "grok-bot": {
      "identity": "documented-product",
      "status": "native-adapter",
      "adapterPresent": true,
      "compatibilityVerified": false,
      "delivery": "skill-protocol-cli",
      "entrypoints": [
        "bin/ultrathink-grokbot",
        "src/host/grokbot-cli.ts",
        "hosts/grok-bot/README.md",
        "hosts/grok-bot/skills/ultrathink-protocol/SKILL.md",
        "hosts/grok-bot/skills/ultrathink-plan/SKILL.md",
        "hosts/grok-bot/skills/ultrathink-kickoff/SKILL.md",
        "hosts/grok-bot/skills/ultrathink-sync/SKILL.md",
        "docs/how-to/use-with-grok-bot.md"
      ]
    },
    "gpt-dot": {
      "identity": "unverified",
      "status": "pending-identity-and-contract",
      "adapterPresent": false,
      "compatibilityVerified": false
    }
  }
}
